{
  "schemaVersion": "1.0",
  "eventId": "00000000000000000000000000000001",
  "traceId": "00000000000000000000000000000002",
  "spanId": "00000000000000000000000000000003",
  "sequence": 0,
  "timestamp": "2026-07-16T00:00:00.000Z",
  "type": "trace.start",
  "name": "customer-support",
  "status": "unset",
  "serviceName": "fixture-agent",
  "attributes": {}
}
