{
  "schemaVersion": "1.0",
  "eventId": "00000000000000000000000000000007",
  "traceId": "00000000000000000000000000000002",
  "spanId": "00000000000000000000000000000003",
  "sequence": 4,
  "timestamp": "2026-07-16T00:00:00.060Z",
  "type": "evaluation.score",
  "name": "answer-quality",
  "status": "ok",
  "serviceName": "fixture-agent",
  "attributes": { "score": 0.94 }
}
